{
  "schema_version": 1,
  "id": "provision-one-bss",
  "purpose": "Pending genuine EasyMesh WSC provisioning; P0 required. No semantic fallback.",
  "initiating_interface": "easymesh-wire",
  "required_backend": "any-simulation",
  "requirements": [
    "W01",
    "W02",
    "W04"
  ],
  "prerequisites": [
    "P0",
    "synthetic-existing-bss-v1"
  ],
  "target_allowlist": [
    "pod-1"
  ],
  "intent": {
    "pod_id": "pod-1",
    "radio_id": "radio-1",
    "bss_id": "bss-1",
    "ssid": "emosa-lab",
    "secret_ref": "scenario-key",
    "enabled": true,
    "security_mode": "wpa2-psk"
  },
  "expected": {
    "state": "OBSERVED_APPLIED",
    "commit_attribution": "reply",
    "changed_fields": [
      "ssid",
      "wpa_psks[key]"
    ]
  },
  "fault": {
    "point": "after-config-commit",
    "action": "none",
    "duration_seconds": 0
  },
  "seed": 7,
  "repetitions": 1,
  "deadlines": {
    "apply_seconds": 30,
    "overall_seconds": 45
  },
  "topology": {
    "management_path": "private-unix-socket",
    "target_carries_management": false
  },
  "cleanup": "dispose-simulation",
  "evidence_required": [
    "events",
    "observations",
    "transaction",
    "pcap"
  ]
}
